{
  "$schema": "http://json-schema.org/draft-07/schema#",
  "title": "Seen URLs Database",
  "description": "Tracks URLs that have already been processed to avoid duplicates",
  "type": "object",
  "required": ["version", "last_updated", "total_count", "urls"],
  "properties": {
    "version": {
      "type": "string",
      "description": "Schema version"
    },
    "last_updated": {
      "type": "string",
      "format": "date-time",
      "description": "ISO 8601 timestamp of last update"
    },
    "total_count": {
      "type": "integer",
      "minimum": 0,
      "description": "Total number of tracked URLs"
    },
    "urls": {
      "type": "object",
      "description": "Map of normalized URL to tracking info",
      "additionalProperties": {
        "type": "object",
        "required": ["url", "first_seen"],
        "properties": {
          "url": {
            "type": "string",
            "description": "The original URL"
          },
          "first_seen": {
            "type": "string",
            "format": "date-time",
            "description": "When the URL was first processed"
          },
          "linked_record_id": {
            "type": ["string", "null"],
            "description": "ID of the linked monitoring or regulation record created from this URL, if any"
          }
        }
      }
    }
  }
}
